[
  {
    "schemaVersion": "lucida-approval/v1",
    "approvalId": "w9-production-treatment-huy",
    "runId": "w9-gpt-5-6-production-20260717",
    "kind": "visual-treatment",
    "status": "approved",
    "artifactHash": "sha256:87f9cff8d56d88a644affe530c3957a9eb25fde749432e56698af0e835402021",
    "approvedBy": "HUY",
    "approvedAt": "2026-07-17T00:00:00+09:00"
  },
  {
    "schemaVersion": "lucida-approval/v1",
    "approvalId": "w9-production-map-huy",
    "runId": "w9-gpt-5-6-production-20260717",
    "kind": "video-map",
    "status": "approved",
    "artifactHash": "sha256:19789f6ef6869862f94e73ef0a9c2db8476edd8806f155a3bff13719823a9ff3",
    "approvedBy": "HUY",
    "approvedAt": "2026-07-17T00:00:00+09:00"
  }
]
