[
  {
    "schemaVersion": "lucida-approval/v1",
    "approvalId": "w9-production-treatment-huy-r4",
    "runId": "w9-gpt-5-6-production-20260717-r4",
    "kind": "visual-treatment",
    "status": "approved",
    "artifactHash": "sha256:87f9cff8d56d88a644affe530c3957a9eb25fde749432e56698af0e835402021",
    "approvedBy": "HUY",
    "approvedAt": "2026-07-17T00:00:00+09:00"
  },
  {
    "schemaVersion": "lucida-approval/v1",
    "approvalId": "w9-production-map-huy-r4",
    "runId": "w9-gpt-5-6-production-20260717-r4",
    "kind": "video-map",
    "status": "approved",
    "artifactHash": "sha256:2e9560e38b9944e61c1d34a35682c7166bf122068355f6d4f4ebca8916575414",
    "approvedBy": "HUY",
    "approvedAt": "2026-07-17T00:00:00+09:00"
  }
]
